{
  "id": "openpcb.core.3d.passive.r-1210",
  "uuid": "1add8ea0-fd84-599a-b01d-4c8bbe331281",
  "version": "1.0.0",
  "name": "R_1210_3225Metric STEP model",
  "formats": {
    "step": {
      "path": "3d/passive/r-1210.step",
      "sha256": "44b152a107ee844595f54f1205cd4e0e37cebb9635affbe45f530daada41d245"
    }
  },
  "provenance": {
    "source": "kicad-derived",
    "license": "CC-BY-SA-4.0+KiCad-Libraries-Exception",
    "attribution": [
      "Derived from KiCad official libraries."
    ],
    "sourceFormat": "step",
    "sourceFileName": "R_1210_3225Metric.step",
    "sourceLibrary": "Resistor_SMD",
    "sourceItemName": "R_1210_3225Metric.step",
    "sourceHash": "44b152a107ee844595f54f1205cd4e0e37cebb9635affbe45f530daada41d245",
    "upstreamUrl": "https://gitlab.com/kicad/libraries",
    "convertedAt": "2026-05-21T00:00:00.000Z",
    "conversionTool": "CoreLibrary tools/backfill-step-models.ts"
  },
  "offsetMm": {
    "x": 0,
    "y": 0,
    "z": 0
  },
  "rotationDeg": {
    "x": 0,
    "y": 0,
    "z": 0
  }
}
