{
  "id": "openpcb.core.3d.diode.d-sod-123",
  "uuid": "77dec2cf-2daf-5fe1-ae7e-545e08b38c77",
  "version": "1.0.0",
  "name": "D_SOD-123 STEP model",
  "formats": {
    "step": {
      "path": "3d/diode/d-sod-123.step",
      "sha256": "b3dc4065573abc72e3d5b4cca0e908f72a24205a41b6284b1f75ccacbe99adf8"
    }
  },
  "provenance": {
    "source": "kicad-derived",
    "license": "CC-BY-SA-4.0+KiCad-Libraries-Exception",
    "attribution": [
      "Derived from KiCad official libraries."
    ],
    "sourceFormat": "step",
    "sourceFileName": "D_SOD-123.step",
    "sourceLibrary": "Diode_SMD",
    "sourceItemName": "D_SOD-123.step",
    "sourceHash": "b3dc4065573abc72e3d5b4cca0e908f72a24205a41b6284b1f75ccacbe99adf8",
    "upstreamUrl": "https://gitlab.com/kicad/libraries",
    "convertedAt": "2026-05-21T00:00:00.000Z",
    "conversionTool": "CoreLibrary tools/import-kicad-batch.ts"
  },
  "offsetMm": {
    "x": 0,
    "y": 0,
    "z": 0
  },
  "rotationDeg": {
    "x": 0,
    "y": 0,
    "z": 0
  }
}
