{
  "id": "openpcb.core.3d.connector.pin-socket-2x03-p2-54mm-vertical",
  "uuid": "2d6a8867-2570-569e-a6c9-3f2d29616d39",
  "version": "1.0.0",
  "name": "PinSocket_2x03_P2.54mm_Vertical STEP model",
  "formats": {
    "step": {
      "path": "3d/connector/pin-socket-2x03-p2-54mm-vertical.step",
      "sha256": "346e78c1d2aa44f358c7aa526db4817f703de06ad8c27213fa22c868adfaf72b"
    }
  },
  "provenance": {
    "source": "kicad-derived",
    "license": "CC-BY-SA-4.0+KiCad-Libraries-Exception",
    "attribution": [
      "Derived from KiCad official libraries."
    ],
    "sourceFormat": "step",
    "sourceFileName": "PinSocket_2x03_P2.54mm_Vertical.step",
    "sourceLibrary": "Connector_PinSocket_2.54mm",
    "sourceItemName": "PinSocket_2x03_P2.54mm_Vertical.step",
    "sourceHash": "346e78c1d2aa44f358c7aa526db4817f703de06ad8c27213fa22c868adfaf72b",
    "upstreamUrl": "https://gitlab.com/kicad/libraries",
    "convertedAt": "2026-05-21T00:00:00.000Z",
    "conversionTool": "CoreLibrary tools/import-kicad-batch.ts"
  },
  "offsetMm": {
    "x": 0,
    "y": 0,
    "z": 0
  },
  "rotationDeg": {
    "x": 0,
    "y": 0,
    "z": 0
  }
}
