{
  "id": "openpcb.core.3d.passive.r-axial-din0207-p10-16",
  "uuid": "16db61ee-405b-52ae-9112-6df76add944d",
  "version": "1.0.0",
  "name": "R_Axial_DIN0207_L6.3mm_D2.5mm_P10.16mm_Horizontal STEP model",
  "formats": {
    "step": {
      "path": "3d/passive/r-axial-din0207-p10-16.step",
      "sha256": "85bdadc9190739c38429da06b1d9c76ccf33aef9a0794a2e7a9dd5b58d9d05fe"
    }
  },
  "provenance": {
    "source": "kicad-derived",
    "license": "CC-BY-SA-4.0+KiCad-Libraries-Exception",
    "attribution": [
      "Derived from KiCad official libraries."
    ],
    "sourceFormat": "step",
    "sourceFileName": "R_Axial_DIN0207_L6.3mm_D2.5mm_P10.16mm_Horizontal.step",
    "sourceLibrary": "Resistor_THT",
    "sourceItemName": "R_Axial_DIN0207_L6.3mm_D2.5mm_P10.16mm_Horizontal.step",
    "sourceHash": "85bdadc9190739c38429da06b1d9c76ccf33aef9a0794a2e7a9dd5b58d9d05fe",
    "upstreamUrl": "https://gitlab.com/kicad/libraries",
    "convertedAt": "2026-05-21T00:00:00.000Z",
    "conversionTool": "CoreLibrary tools/backfill-step-models.ts"
  },
  "offsetMm": {
    "x": 0,
    "y": 0,
    "z": 0
  },
  "rotationDeg": {
    "x": 0,
    "y": 0,
    "z": 0
  }
}
